Release Date,Character,Rarity,Constellation Description,Word Count
2020-09-28,traveler(anemo),5star,"Palm Vortex pulls in enemies within a 5m radius. Increases Energy Recharge by 16%. Increases the Level of Gust Surge by 3. Maximum upgrade level is 15. Reduces DMG taken while casting Palm Vortex by 10%. Increase the Level of Palm Vortex by 3. Maximum upgrade level is 15. Targets who take DMG from Gust Surge have their Anemo RES decreased by 20%. If an Elemental Absorption occurred, then their RES towards the corresponding Element is also decreased by 20%.",80
2020-09-28,traveler(dendro),5star,"After Razorgrass Blade hits an opponent, it will regenerate 3.5 Energy for the Traveler. Lea Lotus Lamp's duration is increased by 3s. Increases the Level of Razorgrass Blade by 3. Maximum upgrade level is 15. After the Lea Lotus Lamp triggers a Lotuslight Transfiguration, it will obtain 5 stacks of the Overflowing Lotuslight effect from the Passive Talent ""Verdant Overgrowth."" You must have unlocked this Passive Talent first. Increase the Level of Surgent Manifestation by 3. Maximum upgrade level is 15. The Dendro DMG Bonus of the character under the effect of Overflowing Lotuslight as created by the Lea Lotus Lamp is increased by 12%. If the Lamp has experienced a Lotuslight Transfiguration previously, the character will also gain 12% DMG Bonus for the corresponding element.",126
2020-09-28,qiqi,5star,"When the Herald of Frost hits an enemy marked by a Fortune-Preserving Talisman, Qiqi regenerates 2 Energy. Qiqi's Normal and Charge Attack DMG against enemies affected by Cryo is increased by 15%. Increases the Level of Adeptus Art: Preserver of Fortune by 3. Maximum upgrade level is 15. Targets marked by the Fortune-Preserving Talisman have their ATK decreased by 20%. Increase the Level of Adeptus Art: Herald of Frost by 3. Maximum upgrade level is 15. Using Adeptus Art: Preserve of Fortune revives all nearby fallen characters and regenerates 50% of their HP. This effect can only occur once every 15 mins.",102
2020-09-28,mona,5star,"The effects of Hydro-related Elemental Reactions are enhanced for 8s after a character hits an enemy affected by an Omen: Electro-Charged DMG is increased by 15%. Vaporize DMG is increased by 15%. Hydro Swirl DMG is increased by 15%. The duration for which enemies are Frozen is increased by 15%. When a Normal Attack hits, there is a 20% chance that it will be automatically followed by a Charged Attack. This effect can only occur once every 5s. Increases the Level of Stellaris Phantasm by 3. Maximum upgrade level is 15. When a character attacks an enemy affected by the Omen status effect, their CRIT Rate is increased by 15%. Increase the Level of Mirror Reflection of Doom by 3. Maximum upgrade level is 15. Upon entering Illusory Torrent, Mona gain a 60% increase to the DMG her next Charged Attack per second of movement. A maximum DMG Bonus of 180% can be achieved in this manner. The effect lasts for no more than 8s.",165
2020-09-28,keqing,5star,"Recasting Stellar Restoration while a Lightning Stiletto is present causes Keqing to deal 50% of her ATK as AoE Electro DMG at the start point and terminus of her Blink. When Keqing's Normal and Charged Attack's hit enemies affected by Electro, they have a 50% chance of producing an Elemental Particle. This effect can only occur once every 5s. Increases the Level of Starward Sword by 3. Maximum upgrade level is 15. For 10s after Keqing triggers an Electro-related Elemental Reaction, her ATK is increased by 25%. Increase the Level of Stellar Restoration by 3. Maximum upgrade level is 15. When initiating a Normal Attack, Charged Attack, Elemental Skill or Elemental Burst, Keqing gains a 6% Electro DMG Bonus for 8s. Effects triggered by Normal Attacks, Charged Attacks, Elemental Skills and Elemental Bursts are considered independent entities.",137
